{
  "bank": {
    "board": "ICSE",
    "bookTitle": "Cordova Learning Series English - 6",
    "chapterNumber": 16,
    "grade": 6,
    "id": "thank-you-maam",
    "status": "reviewed",
    "subject": "English Literature",
    "title": "Thank You, Ma’am",
    "version": 1
  },
  "questions": [
    {
      "answer": {
        "accepted": [
          "strap"
        ]
      },
      "difficulty": 1,
      "explanation": "The missing phrase is strap.",
      "generation": {
        "generatedAt": "2026-09-27T12:44:58Z",
        "method": "codex-assisted",
        "validationStatus": "verified"
      },
      "hint": "Use the word or phrase from the story.",
      "id": "q-001",
      "marks": 1,
      "origin": "end_exercise",
      "prompt": "As Roger tried to snatch the purse, its long ____ broke with a single tug.",
      "response": {},
      "rubric": {
        "exact": true
      },
      "selectionPriority": 1,
      "sourceRefs": [
        {
          "pageId": "page-111",
          "regionId": "exercise",
          "supports": [
            "prompt"
          ]
        },
        {
          "pageId": "page-109",
          "regionId": "story",
          "supports": [
            "answer",
            "rubric",
            "hint",
            "explanation"
          ]
        }
      ],
      "status": "active",
      "topicIds": [
        "attempt"
      ],
      "type": "fill_blank",
      "version": 1
    },
    {
      "answer": {
        "accepted": [
          "pick up"
        ]
      },
      "difficulty": 1,
      "explanation": "The missing phrase is pick up.",
      "generation": {
        "generatedAt": "2026-09-27T12:44:58Z",
        "method": "codex-assisted",
        "validationStatus": "verified"
      },
      "hint": "Use the word or phrase from the story.",
      "id": "q-002",
      "marks": 1,
      "origin": "end_exercise",
      "prompt": "Mrs Jones bent down enough to let Roger ____ her purse.",
      "response": {},
      "rubric": {
        "exact": true
      },
      "selectionPriority": 1,
      "sourceRefs": [
        {
          "pageId": "page-111",
          "regionId": "exercise",
          "supports": [
            "prompt"
          ]
        },
        {
          "pageId": "page-109",
          "regionId": "story",
          "supports": [
            "answer",
            "rubric",
            "hint",
            "explanation"
          ]
        }
      ],
      "status": "active",
      "topicIds": [
        "attempt"
      ],
      "type": "fill_blank",
      "version": 1
    },
    {
      "answer": {
        "accepted": [
          "jerked"
        ]
      },
      "difficulty": 1,
      "explanation": "The missing phrase is jerked.",
      "generation": {
        "generatedAt": "2026-09-27T12:44:58Z",
        "method": "codex-assisted",
        "validationStatus": "verified"
      },
      "hint": "Use the word or phrase from the story.",
      "id": "q-003",
      "marks": 1,
      "origin": "end_exercise",
      "prompt": "Mrs Jones stooped and ____ Roger around in front of her.",
      "response": {},
      "rubric": {
        "exact": true
      },
      "selectionPriority": 1,
      "sourceRefs": [
        {
          "pageId": "page-111",
          "regionId": "exercise",
          "supports": [
            "prompt"
          ]
        },
        {
          "pageId": "page-110",
          "regionId": "story",
          "supports": [
            "answer",
            "rubric",
            "hint",
            "explanation"
          ]
        }
      ],
      "status": "active",
      "topicIds": [
        "response"
      ],
      "type": "fill_blank",
      "version": 1
    },
    {
      "answer": {
        "accepted": [
          "presentable"
        ]
      },
      "difficulty": 1,
      "explanation": "The missing phrase is presentable.",
      "generation": {
        "generatedAt": "2026-09-27T12:44:58Z",
        "method": "codex-assisted",
        "validationStatus": "verified"
      },
      "hint": "Use the word or phrase from the story.",
      "id": "q-004",
      "marks": 1,
      "origin": "end_exercise",
      "prompt": "Mrs Jones wanted Roger to wash his face and comb his hair so that he would look ____.",
      "response": {},
      "rubric": {
        "exact": true
      },
      "selectionPriority": 1,
      "sourceRefs": [
        {
          "pageId": "page-111",
          "regionId": "exercise",
          "supports": [
            "prompt"
          ]
        },
        {
          "pageId": "page-110",
          "regionId": "story",
          "supports": [
            "answer",
            "rubric",
            "hint",
            "explanation"
          ]
        }
      ],
      "status": "active",
      "topicIds": [
        "care"
      ],
      "type": "fill_blank",
      "version": 1
    },
    {
      "answer": {
        "correctOptionId": "b"
      },
      "difficulty": 1,
      "explanation": "The page credits James Mercer Langston Hughes.",
      "generation": {
        "generatedAt": "2026-09-27T12:44:58Z",
        "method": "codex-assisted",
        "validationStatus": "verified"
      },
      "hint": "Recall the detail described in the story.",
      "id": "q-005",
      "marks": 1,
      "origin": "chapter_content",
      "prompt": "Who wrote the story adapted as “Thank You, Ma’am”?",
      "response": {
        "options": [
          {
            "id": "a",
            "text": "Ruskin Bond"
          },
          {
            "id": "b",
            "text": "Langston Hughes"
          },
          {
            "id": "c",
            "text": "Romesh Gunesekera"
          },
          {
            "id": "d",
            "text": "Robert Louis Stevenson"
          }
        ]
      },
      "rubric": {
        "exact": true
      },
      "selectionPriority": 2,
      "sourceRefs": [
        {
          "pageId": "page-109",
          "regionId": "story",
          "supports": [
            "prompt",
            "answer",
            "rubric",
            "hint",
            "explanation"
          ]
        },
        {
          "pageId": "page-111",
          "regionId": "story",
          "supports": [
            "prompt",
            "answer",
            "rubric",
            "hint",
            "explanation"
          ]
        }
      ],
      "status": "active",
      "topicIds": [
        "language"
      ],
      "type": "single_choice",
      "version": 1
    },
    {
      "answer": {
        "correctOptionId": "a"
      },
      "difficulty": 1,
      "explanation": "The opening says it was about eleven o’clock at night.",
      "generation": {
        "generatedAt": "2026-09-27T12:44:58Z",
        "method": "codex-assisted",
        "validationStatus": "verified"
      },
      "hint": "Recall the detail described in the story.",
      "id": "q-006",
      "marks": 1,
      "origin": "chapter_content",
      "prompt": "At about what time does Roger try to snatch the purse?",
      "response": {
        "options": [
          {
            "id": "a",
            "text": "Eleven o’clock at night"
          },
          {
            "id": "b",
            "text": "Seven o’clock in the morning"
          },
          {
            "id": "c",
            "text": "Midday"
          },
          {
            "id": "d",
            "text": "Six o’clock in the evening"
          }
        ]
      },
      "rubric": {
        "exact": true
      },
      "selectionPriority": 2,
      "sourceRefs": [
        {
          "pageId": "page-109",
          "regionId": "story",
          "supports": [
            "prompt",
            "answer",
            "rubric",
            "hint",
            "explanation"
          ]
        }
      ],
      "status": "active",
      "topicIds": [
        "attempt"
      ],
      "type": "single_choice",
      "version": 1
    },
    {
      "answer": {
        "correctOptionId": "c"
      },
      "difficulty": 1,
      "explanation": "Roger says he wants blue suede shoes.",
      "generation": {
        "generatedAt": "2026-09-27T12:44:58Z",
        "method": "codex-assisted",
        "validationStatus": "verified"
      },
      "hint": "Recall the detail described in the story.",
      "id": "q-007",
      "marks": 1,
      "origin": "chapter_content",
      "prompt": "What does Roger say he wants to buy?",
      "response": {
        "options": [
          {
            "id": "a",
            "text": "A warm coat"
          },
          {
            "id": "b",
            "text": "A new school bag"
          },
          {
            "id": "c",
            "text": "A pair of blue suede shoes"
          },
          {
            "id": "d",
            "text": "A train ticket"
          }
        ]
      },
      "rubric": {
        "exact": true
      },
      "selectionPriority": 2,
      "sourceRefs": [
        {
          "pageId": "page-110",
          "regionId": "story",
          "supports": [
            "prompt",
            "answer",
            "rubric",
            "hint",
            "explanation"
          ]
        }
      ],
      "status": "active",
      "topicIds": [
        "care"
      ],
      "type": "single_choice",
      "version": 1
    },
    {
      "answer": {
        "correctOptionId": "b"
      },
      "difficulty": 1,
      "explanation": "She tells Roger about her job in a hotel beauty shop.",
      "generation": {
        "generatedAt": "2026-09-27T12:44:58Z",
        "method": "codex-assisted",
        "validationStatus": "verified"
      },
      "hint": "Recall the detail described in the story.",
      "id": "q-008",
      "marks": 1,
      "origin": "chapter_content",
      "prompt": "Where does Mrs Jones say she works?",
      "response": {
        "options": [
          {
            "id": "a",
            "text": "At a school"
          },
          {
            "id": "b",
            "text": "In a hotel beauty shop"